ECS_Version,Indexed,Field_Set,Field,Type,Level,Normalization,Example,Description
9.1.0,true,file,file.x509.not_after,date,extended,,2020-07-16T03:15:39Z,Time at which the certificate is no longer considered valid.
9.1.0,true,file,file.x509.not_before,date,extended,,2019-08-16T01:40:25Z,Time at which the certificate is first considered valid.
9.1.0,true,file,file.x509.public_key_algorithm,keyword,extended,,RSA,Algorithm used to generate the public key.
9.1.0,true,file,file.x509.public_key_curve,keyword,extended,,nistp521,The curve used by the elliptic curve public key algorithm. This is algorithm specific.
9.1.0,false,file,file.x509.public_key_exponent,long,extended,,65537,Exponent used to derive the public key. This is algorithm specific.
9.1.0,true,file,file.x509.public_key_size,long,extended,,2048,The size of the public key space in bits.
9.1.0,true,file,file.x509.serial_number,keyword,extended,,55FBB9C7DEBF09809D12CCAA,Unique serial number issued by the certificate authority.
9.1.0,true,file,file.x509.signature_algorithm,keyword,extended,,SHA256-RSA,Identifier for certificate signature algorithm.
9.1.0,true,file,file.x509.subject.common_name,keyword,extended,array,shared.global.example.net,List of common names (CN) of subject.
9.1.0,true,file,file.x509.subject.country,keyword,extended,array,US,List of country \(C) code
9.1.0,true,file,file.x509.subject.distinguished_name,keyword,extended,,"C=US, ST=California, L=San Francisco, O=Example, Inc., CN=shared.global.example.net",Distinguished name (DN) of the certificate subject entity.
9.1.0,true,file,file.x509.subject.locality,keyword,extended,array,San Francisco,List of locality names (L)
9.1.0,true,file,file.x509.subject.organization,keyword,extended,array,"Example, Inc.",List of organizations (O) of subject.
9.1.0,true,file,file.x509.subject.organizational_unit,keyword,extended,array,,List of organizational units (OU) of subject.
9.1.0,true,file,file.x509.subject.state_or_province,keyword,extended,array,California,"List of state or province names (ST, S, or P)"
9.1.0,true,file,file.x509.version_number,keyword,extended,,3,Version of x509 format.
9.1.0,true,gcp_audit,gcp_audit.actor.entity_id,nested,custom,,,The unique identifier of the entity that performed the audited action
9.1.0,true,gcp_audit,gcp_audit.authenticationinfo.principalsubject,keyword,custom,,example-principalsubject,The purpose of this field needs to be defined
9.1.0,true,gcp_audit,gcp_audit.authenticationinfo.serviceaccountdelegationinfo,nested,custom,array,,The service account delegatio information
9.1.0,true,gcp_audit,gcp_audit.authenticationinfo.serviceaccountkeyname,keyword,custom,,example-serviceaccountkeyname,This field captures authentication details whenever an API call or action is performed in GCP
9.1.0,true,gcp_audit,gcp_audit.authorizationinfo,nested,custom,array,,The gcp audit log authorization information
9.1.0,true,gcp_audit,gcp_audit.event_provider,keyword,custom,,example-event_provider,The provider of the audit event
9.1.0,true,gcp_audit,gcp_audit.labels,object,custom,,,The GCP audit labels information
9.1.0,true,gcp_audit,gcp_audit.metadata.@type,keyword,custom,,example-@type,The type of GCP audit metadata
9.1.0,true,gcp_audit,gcp_audit.metadata.accessLevels,keyword,custom,array,example-accessLevels,The access levels in the gcp audit metadata
9.1.0,true,gcp_audit,gcp_audit.metadata.identityDelegationChain,keyword,custom,array,example-identityDelegationChain,The identity delegation chain in the gcp audit metadata
9.1.0,true,gcp_audit,gcp_audit.metadata.ingressViolations,nested,custom,array,,The GCP audit metadata ingress violations information
9.1.0,true,gcp_audit,gcp_audit.metadata.operationType,keyword,custom,,example-operationType,The operation type in the GCP audit metadata
9.1.0,true,gcp_audit,gcp_audit.metadata.resourceNames,keyword,custom,array,example-resourceNames,The resource names in the GCP audit metadata
9.1.0,true,gcp_audit,gcp_audit.metadata.securityPolicyInfo.organizationId,keyword,custom,,example-organizationId,The organization identifier in the security policy information
9.1.0,true,gcp_audit,gcp_audit.metadata.securityPolicyInfo.servicePerimeterName,keyword,custom,,example-servicePerimeterName,The service perimeter in the security policy information
9.1.0,true,gcp_audit,gcp_audit.metadata.usedResources.attachedDisks,nested,custom,array,,The attached disks in the used resources
9.1.0,true,gcp_audit,gcp_audit.metadata.violationReason,keyword,custom,,example-violationReason,The violation reason information stored in the metadata
9.1.0,true,gcp_audit,gcp_audit.metadata.vpcServiceControlsUniqueId,keyword,custom,,example-vpcServiceControlsUniqueId,The VPC service controls unique identifier in the metadata
9.1.0,true,gcp_audit,gcp_audit.numresponseitems,long,custom,,12345,Number of items returned in the response
9.1.0,true,gcp_audit,gcp_audit.operation.id,keyword,custom,,example-id,An identifier for the audit log operation
9.1.0,true,gcp_audit,gcp_audit.orgpolicyviolationinfo.payload.key1,keyword,custom,,example-key1,The key in the payload policy violatio information
9.1.0,true,gcp_audit,gcp_audit.orgpolicyviolationinfo.payload.key2,keyword,custom,,example-key2,The key in the payload policy violatio information
9.1.0,true,gcp_audit,gcp_audit.orgpolicyviolationinfo.resourcetags.instance_id,keyword,custom,,example-instance_id,The insance ID present in the resource tags in the policy violation information
9.1.0,true,gcp_audit,gcp_audit.orgpolicyviolationinfo.resourcetags.zone,keyword,custom,,example-zone,The zone present in the resource tags in the policy violation information
9.1.0,true,gcp_audit,gcp_audit.related.entity,nested,custom,,,Information about related entities connected to the audited operation
9.1.0,true,gcp_audit,gcp_audit.request.@type,keyword,custom,,example-@type,The message type of the request payload
9.1.0,true,gcp_audit,gcp_audit.request.apiVersion,keyword,custom,,example-apiVersion,The version of the API used in the request
9.1.0,true,gcp_audit,gcp_audit.request.disks,keyword,custom,array,example-disks,The details of the disks in the request information
9.1.0,true,gcp_audit,gcp_audit.request.family,keyword,custom,,example-family,Indicates the resource family or category associated with the audit request
9.1.0,true,gcp_audit,gcp_audit.request.guestOsFeatures,nested,custom,array,,Specifies the operating system features requested for a guest VM instance
9.1.0,true,gcp_audit,gcp_audit.request.kind,keyword,custom,,example-kind,Identifies the type of API resource or operation object in the request
9.1.0,true,gcp_audit,gcp_audit.request.machineType,keyword,custom,,example-machineType,The Compute Engine machine type (CPU/memory configuration) requested for a VM
9.1.0,true,gcp_audit,gcp_audit.request.metadata.creationTimestamp,date,custom,,2023-01-01T00:00:00.000Z,The timestamp indicating when the resource was created
9.1.0,true,gcp_audit,gcp_audit.request.name,keyword,custom,,example-name,The name assigned to the resource being created or modified
9.1.0,true,gcp_audit,gcp_audit.request.networkInterfaces,nested,custom,array,,"The list of network interfaces attached to a VM (e.g., IPs, subnets, VPCs)"
9.1.0,true,gcp_audit,gcp_audit.request.pageSize,keyword,custom,,example-pageSize,The maximum number of items to return in a paginated API response
9.1.0,true,gcp_audit,gcp_audit.request.page_token,keyword,custom,,example-page_token,A continuation token to fetch the next page of results in paginated requests
9.1.0,true,gcp_audit,gcp_audit.request.policy.bindings,nested,custom,array,,The IAM role-to-member mappings defined in a policy
9.1.0,true,gcp_audit,gcp_audit.request.policy.etag,keyword,custom,,example-etag,A unique identifier used for concurrency control when updating an IAM policy
9.1.0,true,gcp_audit,gcp_audit.request.policyvalue,keyword,custom,,example-policyvalue,The full IAM policy object or value applied to a resource
9.1.0,true,gcp_audit,gcp_audit.request.rawDisk.source,keyword,custom,,example-source,The source disk or image used when creating a new raw disk
9.1.0,true,gcp_audit,gcp_audit.request.resource,keyword,custom,,example-resource,Specifies the type or specification of the resource targeted in the request
9.1.0,true,gcp_audit,gcp_audit.request.resourceName,keyword,custom,,example-resourceName,The fully qualified name of the resource on which the action is performed
9.1.0,true,gcp_audit,gcp_audit.request.serviceAccounts,nested,custom,array,,"Lists the service accounts associated with the resource (e.g., attached to a VM)"
9.1.0,true,gcp_audit,gcp_audit.request.sourceType,keyword,custom,,example-sourceType,"Indicates the origin type of the resource or workload (e.g., image, snapshot, or template)"
9.1.0,true,gcp_audit,gcp_audit.request.spec.group,nested,custom,array,,"Represents the API group of the resource specification, commonly used in Kubernetes-style APIs"
9.1.0,true,gcp_audit,gcp_audit.request.spec.nonResourceAttributes.path,keyword,custom,,example-path,"The API path accessed when the request does not target a specific resource (e.g., /healthz)"
9.1.0,true,gcp_audit,gcp_audit.request.spec.nonResourceAttributes.verb,keyword,custom,,example-verb,"The HTTP verb or action used in the non-resource request (e.g., get, list, create)"
9.1.0,true,gcp_audit,gcp_audit.request.spec.strategy.$retainKeys,keyword,custom,,example-$retainKeys,Indicates which keys should be retained when applying a strategy-based resource update.
9.1.0,true,gcp_audit,gcp_audit.request.spec.template.spec,object,custom,,,"Contains the detailed specification template for the resource (e.g., pod spec in GKE)."
9.1.0,true,gcp_audit,gcp_audit.request.spec.user,keyword,custom,,example-user,The user identity specified in the resource configuration or request
9.1.0,true,gcp_audit,gcp_audit.request.status.allowed,boolean,custom,,True,Indicates whether the requested action was authorized (true) or denied (false)
9.1.0,true,gcp_audit,gcp_audit.resourcelocation.currentlocation,nested,custom,array,,Specifies the geographic location or region where the resource currently resides
9.1.0,true,gcp_audit,gcp_audit.resourcename,keyword,custom,,example-resourcename,The name of the resource that was accessed or modified in the audit event
9.1.0,true,gcp_audit,gcp_audit.response.@type,keyword,custom,,example-@type,The message type of the response payload
9.1.0,true,gcp_audit,gcp_audit.response.apiVersion,keyword,custom,,example-apiVersion,Specifies the API version used in the response.
9.1.0,true,gcp_audit,gcp_audit.response.bindings,nested,custom,array,,Defines role bindings that associate users or groups with roles.
9.1.0,true,gcp_audit,gcp_audit.response.details.group,keyword,custom,,example-group,Indicates the group of the resource in the response details.
9.1.0,true,gcp_audit,gcp_audit.response.details.kind,keyword,custom,,example-kind,Specifies the kind of the resource in the response details.
9.1.0,true,gcp_audit,gcp_audit.response.details.name,keyword,custom,,example-name,Provides the name of the resource in the response details.
9.1.0,true,gcp_audit,gcp_audit.response.details.uid,keyword,custom,,example-uid,Represents the unique identifier (UID) of the resource.
9.1.0,true,gcp_audit,gcp_audit.response.etag,keyword,custom,,example-etag,ETag value used for optimistic concurrency control.
9.1.0,true,gcp_audit,gcp_audit.response.id,keyword,custom,,example-id,Unique identifier of the resource in the response.
9.1.0,true,gcp_audit,gcp_audit.response.insertTime,keyword,custom,,example-insertTime,Timestamp when the resource was inserted.
9.1.0,true,gcp_audit,gcp_audit.response.kind,keyword,custom,,example-kind,Specifies the type or category of the resource.
9.1.0,true,gcp_audit,gcp_audit.response.metadata.annotations,object,custom,,,Annotations metadata associated with the resource.
9.1.0,true,gcp_audit,gcp_audit.response.metadata.creationTimestamp,date,custom,,2023-01-01T00:00:00.000Z,Timestamp of when the resource was created.
9.1.0,true,gcp_audit,gcp_audit.response.metadata.generation,keyword,custom,,example-generation,Version number or generation of the resource.
9.1.0,true,gcp_audit,gcp_audit.response.metadata.labels,object,custom,,,Labels metadata assigned to the resource.
9.1.0,true,gcp_audit,gcp_audit.response.metadata.managedFields,nested,custom,array,,Managed fields metadata describing changes to the resource.
9.1.0,true,gcp_audit,gcp_audit.response.metadata.name,keyword,custom,,example-name,Name of the resource in the metadata section.
9.1.0,true,gcp_audit,gcp_audit.response.metadata.namespace,keyword,custom,,example-namespace,Namespace associated with the resource.
9.1.0,true,gcp_audit,gcp_audit.response.metadata.resourceVersion,keyword,custom,,example-resourceVersion,Resource version used for concurrency control.
9.1.0,true,gcp_audit,gcp_audit.response.metadata.uid,keyword,custom,,example-uid,Unique identifier (UID) of the resource in metadata.
9.1.0,true,gcp_audit,gcp_audit.response.name,keyword,custom,,example-name,Name of the resource defined in the response.
9.1.0,true,gcp_audit,gcp_audit.response.operationType,keyword,custom,,example-operationType,Specifies the type of operation performed.
9.1.0,true,gcp_audit,gcp_audit.response.progress,keyword,custom,,example-progress,Indicates progress of the requested operation.
9.1.0,true,gcp_audit,gcp_audit.response.selfLink,keyword,custom,,example-selfLink,Self-link URL for accessing the resource.
9.1.0,true,gcp_audit,gcp_audit.response.selfLinkWithId,keyword,custom,,example-selfLinkWithId,Self-link URL including the resource identifier.
9.1.0,true,gcp_audit,gcp_audit.response.spec.group,nested,custom,array,,Defines a group specification for the resource.
9.1.0,true,gcp_audit,gcp_audit.response.spec.nonResourceAttributes.path,keyword,custom,,example-path,Path value for non-resource attribute specifications.
9.1.0,true,gcp_audit,gcp_audit.response.spec.nonResourceAttributes.verb,keyword,custom,,example-verb,HTTP verb associated with the non-resource attribute.
9.1.0,true,gcp_audit,gcp_audit.response.spec.progressDeadlineSeconds,keyword,custom,,example-progressDeadlineSeconds,Deadline in seconds for operation progress.
9.1.0,true,gcp_audit,gcp_audit.response.spec.replicas,keyword,custom,,example-replicas,Number of replicas defined for the resource.
9.1.0,true,gcp_audit,gcp_audit.response.spec.revisionHistoryLimit,keyword,custom,,example-revisionHistoryLimit,Number of revisions to retain for rollback.
9.1.0,true,gcp_audit,gcp_audit.response.spec.selector.matchLabels.k8s-app,keyword,custom,,example-k8s-app,Match label used to identify Kubernetes apps.
9.1.0,true,gcp_audit,gcp_audit.response.spec.strategy.rollingUpdate.maxSurge,keyword,custom,,example-maxSurge,Maximum number of pods that can be scheduled above desired replicas during update.
9.1.0,true,gcp_audit,gcp_audit.response.spec.strategy.rollingUpdate.maxUnavailable,keyword,custom,,example-maxUnavailable,Maximum number of pods that can be unavailable during update.
9.1.0,true,gcp_audit,gcp_audit.response.spec.strategy.type,keyword,custom,,example-type,Strategy type used for rolling updates.
9.1.0,true,gcp_audit,gcp_audit.response.spec.template.metadata.annotations,object,custom,,,Annotations in the pod template metadata.
9.1.0,true,gcp_audit,gcp_audit.response.spec.template.metadata.creationTimestamp,date,custom,,2023-01-01T00:00:00.000Z,Creation timestamp of the pod template.
9.1.0,true,gcp_audit,gcp_audit.response.spec.template.metadata.labels.k8s-app,keyword,custom,,example-k8s-app,Labels in the pod template metadata.
9.1.0,true,gcp_audit,gcp_audit.response.spec.template.spec.containers,nested,custom,,,List of containers defined in the pod specification.
9.1.0,true,gcp_audit,gcp_audit.response.spec.template.spec.dnsPolicy,keyword,custom,,example-dnsPolicy,DNS policy applied to the pod specification.
9.1.0,true,gcp_audit,gcp_audit.response.spec.template.spec.nodeSelector,object,custom,,,Node selector used to schedule the pod.
9.1.0,true,gcp_audit,gcp_audit.response.spec.template.spec.priorityClassName,keyword,custom,,example-priorityClassName,Priority class name assigned to the pod.
9.1.0,true,gcp_audit,gcp_audit.response.spec.template.spec.restartPolicy,keyword,custom,,example-restartPolicy,Restart policy applied to the pod.
9.1.0,true,gcp_audit,gcp_audit.response.spec.template.spec.schedulerName,keyword,custom,,example-schedulerName,Scheduler name used for the pod scheduling.
9.1.0,true,gcp_audit,gcp_audit.response.spec.template.spec.securityContext.fsGroup,keyword,custom,,example-fsGroup,File system group ID in the pod security context.
9.1.0,true,gcp_audit,gcp_audit.response.spec.template.spec.securityContext.runAsGroup,keyword,custom,,example-runAsGroup,Run-as group ID in the pod security context.
9.1.0,true,gcp_audit,gcp_audit.response.spec.template.spec.securityContext.runAsUser,keyword,custom,,example-runAsUser,Run-as user ID in the pod security context.
9.1.0,true,gcp_audit,gcp_audit.response.spec.template.spec.serviceAccount,keyword,custom,,example-serviceAccount,Service account associated with the pod.
9.1.0,true,gcp_audit,gcp_audit.response.spec.template.spec.serviceAccountName,keyword,custom,,example-serviceAccountName,Name of the service account assigned to the pod.
9.1.0,true,gcp_audit,gcp_audit.response.spec.template.spec.terminationGracePeriodSeconds,keyword,custom,,example-terminationGracePeriodSeconds,Time in seconds before terminating the pod.
9.1.0,true,gcp_audit,gcp_audit.response.spec.template.spec.tolerations,nested,custom,array,,Tolerations applied to the pod specification.
9.1.0,true,gcp_audit,gcp_audit.response.spec.template.spec.topologySpreadConstraints,nested,custom,array,,Topology spread constraints for distributing pods.
9.1.0,true,gcp_audit,gcp_audit.response.spec.template.spec.volumes,nested,custom,array,,Volumes defined in the pod specification.
9.1.0,true,gcp_audit,gcp_audit.response.spec.user,keyword,custom,,example-user,User associated with the resource specification.
9.1.0,true,gcp_audit,gcp_audit.response.startTime,keyword,custom,,example-startTime,Start time of the operation or process.
9.1.0,true,gcp_audit,gcp_audit.response.status.allowed,boolean,custom,,True,Indicates whether the request or action was allowed.
9.1.0,true,gcp_audit,gcp_audit.response.status.availableReplicas,keyword,custom,,example-availableReplicas,Number of replicas available at the time of the response.
9.1.0,true,gcp_audit,gcp_audit.response.status.conditions,nested,custom,array,,Conditions describing the current status of the resource.
9.1.0,true,gcp_audit,gcp_audit.response.status.observedGeneration,keyword,custom,,example-observedGeneration,Most recent observed generation of the resource.
9.1.0,true,gcp_audit,gcp_audit.response.status.readyReplicas,keyword,custom,,example-readyReplicas,Number of replicas ready for service.
9.1.0,true,gcp_audit,gcp_audit.response.status.reason,keyword,custom,,example-reason,Reason for the current status of the resource.
9.1.0,true,gcp_audit,gcp_audit.response.status.replicas,keyword,custom,,example-replicas,Total number of replicas of the resource.
9.1.0,true,gcp_audit,gcp_audit.response.status.updatedReplicas,keyword,custom,,example-updatedReplicas,Number of replicas updated to the latest version.
9.1.0,true,gcp_audit,gcp_audit.response.statusvalue,keyword,custom,,example-statusvalue,Current status value of the resource.
9.1.0,true,gcp_audit,gcp_audit.response.targetId,keyword,custom,,example-targetId,Identifier of the target resource.
9.1.0,true,gcp_audit,gcp_audit.response.targetLink,keyword,custom,,example-targetLink,Target link URL of the resource.
9.1.0,true,gcp_audit,gcp_audit.response.user,keyword,custom,,example-user,User who initiated the request or operation.
9.1.0,true,gcp_audit,gcp_audit.response.zone,keyword,custom,,example-zone,Zone in which the resource resides.
9.1.0,true,gcp_audit,gcp_audit.servicename,keyword,custom,,example-servicename,The name of the Google Cloud service that processed the request
9.1.0,true,gcp_audit,gcp_audit.status.code,long,custom,,12345,Numeric status code representing the outcome of the request
9.1.0,true,gcp_audit,gcp_audit.status.details,nested,custom,array,,The purpose of this field needs to be defined
9.1.0,true,gcp_audit,gcp_audit.status.message,keyword,custom,,example-message,A human-readable description of the status code
9.1.0,true,gcp_audit,gcp_audit.target.entity_id,nested,custom,,,The unique identifier of the target entity involved in the audited operation
9.1.0,true,gcp_audit,gcp_audit.type,keyword,custom,,example-type,The type classification of the audit event
9.1.0,true,gcp_compute,gcp_compute.event_module,keyword,custom,,example-event_module,The GCP compute log event module name
9.1.0,true,gcp_compute,gcp_compute.labels.user.goog-gke-node,keyword,custom,,example-goog-gke-node,A custom label that identifies the Google Kubernetes Engine node associated with the instance
9.1.0,true,gcp_compute,gcp_compute.metrics.firewall.dropped.bytes,long,custom,,12345,Represents the number of bytes dropped by the firewall as recorded by GCP Compute metrics
9.1.0,true,gcp_compute,gcp_compute.metrics.firewall.dropped_packets_count.value,long,custom,,12345,Represents the count of packets dropped by the firewall as measured in GCP Compute metrics
9.1.0,true,gcp_compute,gcp_compute.metrics.instance.cpu.reserved_cores.value,long,custom,,12345,Indicates the number of CPU cores reserved for the instance specific to GCP Compute metrics
9.1.0,true,gcp_compute,gcp_compute.metrics.instance.cpu.usage.pct,float,custom,,,Shows the CPU usage percentage for the instance according to GCP Compute metrics
9.1.0,true,gcp_compute,gcp_compute.metrics.instance.cpu.usage_time.sec,float,custom,,,Represents the total CPU usage time in seconds for the instance
9.1.0,true,gcp_compute,gcp_compute.metrics.instance.disk.read.bytes,long,custom,,12345,Total number of bytes read from the instance's disks
9.1.0,true,gcp_compute,gcp_compute.metrics.instance.disk.read_ops_count.value,long,custom,,12345,The count of disk read operations performed on the instance
9.1.0,true,gcp_compute,gcp_compute.metrics.instance.disk.write.bytes,long,custom,,12345,Total number of bytes written to the instance's disks
9.1.0,true,gcp_compute,gcp_compute.metrics.instance.disk.write_ops_count.value,long,custom,,12345,The count of disk write operations performed on the instance
9.1.0,true,gcp_compute,gcp_compute.metrics.instance.memory.balloon.ram_size.value,long,custom,,12345,The total RAM size reported via memory ballooning for the instance
9.1.0,true,gcp_compute,gcp_compute.metrics.instance.memory.balloon.ram_used.value,long,custom,,12345,The amount of RAM used as reported by the memory ballooning metrics
9.1.0,true,gcp_compute,gcp_compute.metrics.instance.memory.balloon.swap_in.bytes,long,custom,,12345,The number of bytes swapped into memory for the instance
9.1.0,true,gcp_compute,gcp_compute.metrics.instance.memory.balloon.swap_out.bytes,long,custom,,12345,The number of bytes swapped out of memory for the instance
9.1.0,true,gcp_compute,gcp_compute.metrics.instance.network.egress.bytes,long,custom,,12345,Total outgoing network traffic in bytes for the instance
9.1.0,true,gcp_compute,gcp_compute.metrics.instance.network.egress.packets.count,long,custom,,12345,The count of outgoing network packets for the instance
9.1.0,true,gcp_compute,gcp_compute.metrics.instance.network.ingress.bytes,long,custom,,12345,Total incoming network traffic in bytes for the instance
9.1.0,true,gcp_compute,gcp_compute.metrics.instance.network.ingress.packets.count,long,custom,,12345,The count of incoming network packets for the instance
9.1.0,true,gcp_compute,gcp_compute.metrics.instance.uptime.sec,float,custom,,,The instance uptime in seconds
9.1.0,true,gcp_compute,gcp_compute.metrics.instance.uptime_total.sec,keyword,custom,,example-sec,The total accumulated uptime of the instance in seconds
9.1.0,true,gcp_dns,gcp_dns.authanswer,boolean,custom,,True,Indicates whether the DNS query was authenticated based on the authAnswer flag
9.1.0,true,gcp_dns,gcp_dns.destinationIP,keyword,custom,,example-destinationIP,Contains the destination IP address for the DNS query
9.1.0,true,gcp_dns,gcp_dns.egresserror,keyword,custom,,example-egresserror,Captures any error information related to the egress process for the DNS query
9.1.0,true,gcp_dns,gcp_dns.protocol,keyword,custom,,example-protocol,Indicates the network protocol (e.g. TCP UDP) used for the DNS query
9.1.0,true,gcp_dns,gcp_dns.queryname,keyword,custom,,example-queryname,Represents the fully qualified domain name (FQDN) that was queried
9.1.0,true,gcp_dns,gcp_dns.querytype,keyword,custom,,example-querytype,Specifies the type of DNS record being queried
9.1.0,true,gcp_dns,gcp_dns.rdata,keyword,custom,,example-rdata,Contains the raw resource record data returned in the DNS response
9.1.0,true,gcp_dns,gcp_dns.responsecode,keyword,custom,,example-responsecode,"Indicates the DNS response code such as ""NOERROR"""
9.1.0,true,gcp_dns,gcp_dns.serverlatency,long,custom,,12345,Measures the latency of the DNS server's response
9.1.0,true,gcp_dns,gcp_dns.source_type,keyword,custom,,example-source_type,Classifies the type of source resource for the DNS query
9.1.0,true,gcp_dns,gcp_dns.sourceip,keyword,custom,,example-sourceip,Contains the IP address from which the DNS query was initiated
9.1.0,true,gcp_dns,gcp_dns.sourcenetwork,keyword,custom,,example-sourcenetwork,Represents the network segment or identifier associated with the query's source
9.1.0,true,gcp_dns,gcp_dns.target_type,keyword,custom,,example-target_type,Denotes the type of target resource involved in the DNS query
9.1.0,true,gcp_dns,gcp_dns.vminstanceid,keyword,custom,,example-vminstanceid,Holds the unique identifier of the virtual machine instance that generated the DNS query
9.1.0,true,gcp_dns,gcp_dns.vminstancename,keyword,custom,,example-vminstancename,Contains the original virtual machine instance name prior to any normalization
